{"authority_selectors":["MUTATION_INTENT:PYPI_FILE_UPLOAD_SET","PYPI_FILE_TRANSITION:PENDING_UPLOAD","PYPI_FILE_TRANSITION:SEALED_FOR_UPLOAD"],"batch_sha256":"sha256:3333333333333333333333333333333333333333333333333333333333333333","first_receipt_id":"sha256:4444444444444444444444444444444444444444444444444444444444444444","head_receipt_id":"sha256:1111111111111111111111111111111111111111111111111111111111111111","head_receipt_sha256":"sha256:2222222222222222222222222222222222222222222222222222222222222222","head_sequence":17,"operation_id":"pypi-prepare","receipt_count":8,"release_identity_id":"sha256:3d52af3a2bc6eb185a48465c8680d988a57f7fecf668313673ded1aaed3a59ab","schema":"dpone.release-controller-receipt-batch-projection-response.v1","schema_version":1,"tag":"v0.74.0"}